,Unnamed: 0.1,Unnamed: 0,variable,label,formula,ltdb,ncdb,census_1990_form,census_1990_table_column,census_2000_form,census_2000_table_column,acs,census_2020_table,census_2020_notes,category,notes
138,138,138,n_unemployed_persons,unemployed persons,,unemp,,SF3,P0700003+P0700007,SF3,P043007+P043014,B23001_008E+B23001_015E+B23001_022E+B23001_029E+B23001_036E+B23001_044E+B23001_050E+B23001_057E+B23001_064E+B23001_071E+B23001_094E+B23001_101E+B23001_108E+B23001_115E+B23001_122E+B23001_129E+B23001_136E+B23001_143E+B23001_150E+B23001_157E,,,Socioeconomic Status,
139,139,139,n_employed_over_16,employed persons 16 years and over,,empclf,EMPMT,SF3,P0700002+P0700006,SF3,P049001,B23001_007E+B23001_014E+B23001_021E+B23001_028E+B23001_035E+B23001_042E+B23001_049E+B23001_049E+B23001_056E+B23001_063E+B23001_070E+B23001_093E+B23001_100E+B23001_107E+B23001_114E+B23001_121E+B23001_128E+B23001_135E+B23001_142E+B23001_149E+B23001_156E,,,Socioeconomic Status,
140,140,140,n_employed_professional,professional employees (by occupations),,prof,DLFRAT,SF3,P0780001+P0780002,SF3,P049017+P049044,,,,Socioeconomic Status,
141,141,141,n_employed_manufacturing,manufacturing employees (by industries),,manuf,PRFEMP,SF3,P0770004+P0770005,SF3,P049007+P049034,,,,Socioeconomic Status,
142,142,142,n_employed_self_employed,self-employed,,semp,,SF3,P0790006,SF3,P051012+P051023+P051033+P051044+P051055+P051065,,,,Socioeconomic Status,
143,143,143,n_civilians_over_16,civilian population 16 years and over,,ag16cv,,SF3,P0640002+P0640003+P0640005+P0640006+P0640008+P0640009 +P0640011+P0640012,SF3,P043005+P043012,C24010_001E,,,Socioeconomic Status,
144,144,144,n_civilians_over_18,civilian population 18 years and over,,ag18cv,,,,SF3,P039005+P039010+P039016+P039021,,,,Socioeconomic Status,
145,145,145,n_veterans,veterans,,vet,,SF3,P0640002+P0640005+P0640008+P0640011,SF3,P039006+P039011+P039017+P039022,B21001_002E,,,Socioeconomic Status,
146,146,146,n_civilians_16_64,civilian non-institutionalized persons 16-64 years old,,cni16u,,SF3,P0640002+P0640003+P0640008+P0640009,SF3,P042001,,,,Socioeconomic Status,
147,147,147,n_disabled,disabled,,dis,,SF3,P0680001+P0680002+P0680005+P0680006+P0680009+P0680010+P0680013+P0680014,SF3,P042004+P042007+P042014+P042021+P042024+P042028+P042031+P042038+P042045+P042048,,,,Socioeconomic Status,
148,148,148,median_household_income,Median household income,,hinc,MDHHY,SF3,P080A001,SF3,P053001,B19013_001E,,,Socioeconomic Status,"in 2015 dollars, will need inflation adjustment for timeseries"
149,149,149,n_total_households,total households in sample-based data,,hh,NUMHHS,SF3,P0050001,SF3,P010001,B19001_001E,,,Socioeconomic Status,
150,150,150,median_income_whitehh,Median household income for whites,,hincw,,,,SF3,P152A001,B19013H_001E,,,Socioeconomic Status,"[ek] the 1990 table noted in the LTDB docs only has ranges, not median (e.g. P0820001)"
151,151,151,n_white_households,total white households in sample-based data,,hhw,,SF3,P0080001,SF3,P146A001,B19001H_001E,,,Socioeconomic Status,
152,152,152,median_income_blackhh,Median household income for blacks,,hincb,,,,SF3,P152B001,B19013B_001E,,,Socioeconomic Status,"[ek] the 1990 table noted in the LTDB docs only has ranges, not median (e.g. P0820001)"
153,153,153,n_black_households,total black households in sample-based data,,hhb,,SF3,P0080002,SF3,P146B001,B19001B_001E,,,Socioeconomic Status,
154,154,154,median_income_hispanichh,Median household income for Hispanics,,hinch,,,,SF3,P152H001,B19013I_001E,,,Socioeconomic Status,"[ek] the 1990 table noted in the LTDB docs only has ranges, not median (e.g. P0820001)"
155,155,155,n_hispanic_households,total Hispanic households in sample-based data,,hhh,,SF3,P0210001:07,SF3,P146H001,B19001I_001E,,,Socioeconomic Status,"[ek] the 1990 value is calculated differently than the LTDB codebook, because the their reference (P0830001) doesnt include hispanic origin"
156,156,156,median_income_asianhh,Median household income for Asians and Pacific Islanders,,hinca,,,,SF3,P152D001,,,,Socioeconomic Status,"[ek] the 1990 and 2010 tables noted in the LTDB docs only have ranges, not median (e.g. P0820001 for 1990 and B19001F_012E for 2010)"
157,157,157,n_asian_households,total Asian/Pacific Islander households in sample-based data,,hha,,SF3,P0080004,SF3,P152D001+P152E001,B19001D_001E+B19001E_001E,,,Socioeconomic Status,"unclear how to calculate, since this is only provided as asian or as PI for 2000. Column recorded is asian+pacific islander"
158,158,158,per_capita_income,Per capita income,,incpc,,SF3,P114A001,SF3,P082001,B19301_001E,,,Socioeconomic Status,
159,159,159,n_poverty_determined_persons,persons for whom poverty status is determined,,dpov,DPOVRAT,SF3,P1170001:24,SF3,P087001,B17001_001E,,,Socioeconomic Status,denominator for calculating poverty rate
160,160,160,n_poverty_persons,persons in poverty,,npov,NPOVRAT,SF3,P1170013:24,SF3,P087002,B17001_002E,,,Socioeconomic Status,numerator for calculating poverty rate
161,161,161,n_poverty_over_65,persons 65 years and older in poverty,,n65pov,NELDPOO,SF3,P1170023+P1170024,SF3,P087008+P087009,B17001_015E+B17001_016E+B17001_029E+B17001_030E,,,Socioeconomic Status,
162,162,162,n_poverty_determined_families,families for whom poverty status is determined,,dfmpov,,SF3,P1230001:24,SF3,P090001,B17001_001E,,,Socioeconomic Status,
163,163,163,n_poverty_families_children,families with children in poverty,,nfmpov,,,P1230013:15+P1230017:19+P1230021:23,SF3,P090002,B17010_004E+B17010_011E+B17010_017E,,,Socioeconomic Status,
164,164,164,n_poverty_determined_white,white persons for whom poverty status is determined,,dwpov,DWHTPR,SF3,P1190001:07+P1190036:42,SF3,P159A001,B17001A_001E,,,Socioeconomic Status,is this nonhispanic? Recorded white (regardless). White (not hispanic) is P159I
165,165,165,n_poverty_white,whites in poverty,,nwpov,NWHTPR,SF3,P1190036:42,SF3,P159A002,B17001A_002E,,,Socioeconomic Status,
166,166,166,n_poverty_determined_black,black persons for whom poverty status is determined,,dbpov,DBLKPR,SF3,P1190008:14+P1190043:49,SF3,P159B001,B17001B_001E,,,Socioeconomic Status,
167,167,167,n_poverty_black,blacks in poverty,,nbpov,NBLKPR,SF3,P1190043:49,SF3,P159B002,B17001B_002E,,,Socioeconomic Status,
168,168,168,n_poverty_determined_hispanic,Hispanics for whom poverty status is determined,,dhpov,DHISPR,,,SF3,P159H001,B17020I_001E,,,Socioeconomic Status,[ek] it's not clear to me how LTDB computed values from this variable https://api.census.gov/data/1990/sf3/variables/P1200001.json
169,169,169,n_poverty_hispanic,Hispanics in poverty,,nhpov,NHISPR,,,SF3,P159H002,B17020I_002E,,,Socioeconomic Status,
170,170,170,n_poverty_determined_native,Native American for whom poverty status is determined,,dnapov,DINDPR,SF3,P1190015:21+P1190050:56,SF3,P159C001,B17020C_001E,,,Socioeconomic Status,
171,171,171,n_poverty_native,Native Americans in poverty,,nnapov,INDPR,SF3,P1190050:56,SF3,P159C002,B17020C_002E,,,Socioeconomic Status,
172,172,172,n_poverty_determined_asian,Asians and Pacific Islanders for whom poverty status is determined,,dapov,DASNPR,SF3,P1190022:28+P1190058:63,SF3,P159D001+P159E001,B17020E_001E,,,Socioeconomic Status,"asian alone is D, hawaiian and pac islander is E"
173,173,173,n_poverty_asian,Asians and Pacific Islanders in poverty,,napov,NASNPR,SF3,P1190058:63,SF3,P159D002+P159E002,B17020E_002E,,,Socioeconomic Status,
174,174,174,n_edu_college_greater,persons with at least a four-year college degree,,col,EDUC16,SF3,P0570006+P0570007,SF3,P037015:18+P037032:35,B15002_015E+B15002_016E+B15002_017E+B15002_018E+B15002_032E+B15002_033E+B15002_034E+B15002_035E,,,Socioeconomic Status,
175,175,175,n_edu_hs_less,persons with high school degree or less,,hs,EDUC12,SF3,P0570001+P0570002+P0570003,SF3,P037003:011+P037020:028,B15002_003E+B15002_004E+B15002_005E+B15002_006E+B15002_007E+B15002_008E+B15002_009E+B15002_010E+B15002_020E+B15002_021E+B15002_022E+B15002_023E+B15002_024E+B15002_025E+B15002_026E+B15002_027E,,,Socioeconomic Status,
176,176,176,p_edu_hs_less,percentage of persons with high school degree or less,p_edu_hs_less=n_edu_hs_less / n_persons_over_25*100,phs,,,,,,,,,Socioeconomic Status,
177,177,177,p_edu_college_greater,percentage of persons with at least a four-year college degree,p_edu_college_greater=n_edu_college_greater / n_persons_over_25*100,pcol,,,,,,,,,Socioeconomic Status,
178,178,178,p_unemployment_rate,percent unemployed,p_unemployment_rate=n_unemployed_persons / n_labor_force*100,punemp,UNEMPRT,,,,,,,,Socioeconomic Status,
179,179,179,p_female_labor_force,percentage of females in labor force,,pflabf,,,,,,,,,Socioeconomic Status,
180,180,180,p_employed_professional,percentage of professional employees (by occupations),p_employed_professional=n_employed_professional / n_employed_over_16*100,pprof,,,,,,,,,Socioeconomic Status,
181,181,181,p_employed_manufacturing,percentage of manufacturing employees (by industries),p_employed_manufacturing=n_employed_manufacturing / n_employed_over_16*100,pmanuf,,,,,,,,,Socioeconomic Status,
182,182,182,p_employed_self_employed,percentage of self-employed,p_employed_self_employed=n_employed_self_employed / n_employed_over_16*100,psemp,,,,,,,,,Socioeconomic Status,
183,183,183,p_veterans,percentage of veterans,p_veterans=n_veterans / n_total_pop*100,pvet,,,,,,,,,Socioeconomic Status,
184,184,184,p_disabled,percent with disability,p_disabled=n_disabled / n_total_pop*100,pdis,,,,,,,,,Socioeconomic Status,
185,185,185,p_poverty_rate,percent poor,p_poverty_rate=n_poverty_persons / n_poverty_determined_persons*100,ppov,POVRAT,,,,,,,,Socioeconomic Status,
186,186,186,p_poverty_rate_over_65,percentage of 65 years and older in poverty,p_poverty_rate_over_65=n_poverty_over_65 / n_poverty_determined_persons*100,p65pov,ELDPOO,,,,,,,,Socioeconomic Status,
187,187,187,p_poverty_rate_children,percentage of families with children in poverty,p_poverty_rate_children=n_poverty_families_children / n_poverty_determined_families*100,pfmpov,,,,,,,,,Socioeconomic Status,
188,188,188,p_poverty_rate_white,percentage of whites in poverty,p_poverty_rate_white=n_poverty_white / n_poverty_determined_persons*100,pwpov,WHTPR,,,,,,,,Socioeconomic Status,
189,189,189,p_poverty_rate_black,percentage of blacks in poverty,p_poverty_rate_black=n_poverty_black / n_poverty_determined_persons*100,pbpov,BLKPR,,,,,,,,Socioeconomic Status,
190,190,190,p_poverty_rate_hispanic,percentage of Hispanics in poverty,p_poverty_rate_hispanic=n_poverty_hispanic / n_poverty_determined_persons*100,phpov,,,,,,,,,Socioeconomic Status,
191,191,191,p_poverty_rate_native,percentage of Native Americans in poverty,p_poverty_rate_native=n_poverty_native / n_poverty_determined_persons*100,pnapov,,,,,,,,,Socioeconomic Status,
192,192,192,p_poverty_rate_asian,percentage of Asian and Pacific Islanders in poverty,p_poverty_rate_asian=n_poverty_asian / n_poverty_determined_persons*100,papov,RASPR,,,,,,,,Socioeconomic Status,
193,193,193,n_total_pop,total population,,pop,TRCTPOP,SF1,P0010001,SF1,P001001,B01003_001E,,,total population,
